Name,Rating,Comments,Sentiment,Contradictions
Sabiha Alavi, 1 star ,I ordered  juicer they said this one is not available the other one which one is more expensive available i said ok send me this one when I used this one not at all worth I spend 7800 for this then I asked shall I return this one and pls send me the one I want they said u can not I spoiled all my money I’m USA citizens this is my Pakistani shops experience,Positive, 1 star  Positive
Khurshid Qureshi, 1 star ,They have varieties. Good n clean store. I can afford shopping but I didn't buy anything from there because the prices are too high.,Positive, 1 star  Positive
Farzana Bukhari, 1 star ,Very slow in dealing not satisfied lahore L Fatah has better stander.,Positive, 1 star  Positive
imran javeed, 1 star ,Good achi offers thi,Positive, 1 star  Positive
Awab Hassan, 5 stars ,Crowded as hell but you can get things from different brands not available in Pakistan,Negative, 5 stars  Negative
Hira Salman, 1 star ,Good experience,Positive, 1 star  Positive
Manzar Qureshi, 1 star ,Great. Quality at reasonable price.,Positive, 1 star  Positive
Asif Jah, 5 stars ,"bit costly, but you can find many imported stuff, perfumes, eatables, crockery, sports etc....",Negative, 5 stars  Negative
Sidra Tayyab, 1 star ,Bought treadmill and they promised next day delivery. But after calling so many times they are not responding. Couple of days passed,Positive, 1 star  Positive
